feature selection,"Feature selection is the process of selecting a subset of relevant features (variables, predictors) for use in model construction. Stylometry and DNA microarray analysis are two cases where feature selection is used. It should be distinguished from feature extraction.Feature selection techniques are used for several reasons: simplification of models to make them easier to interpret by researchers/users, shorter training times, to avoid the curse of dimensionality, improve data's compatibility with a learning model class, encode inherent symmetries present in the input space.The central premise when using a feature selection technique is that the data contains some features that are either"
nlp and vision,"Neuro-linguistic programming (NLP) is a pseudoscientific approach to communication, personal development and psychotherapy, that first appeared in Richard Bandler and John Grinder's 1975 book The Structure of Magic I. NLP asserts that there is a connection between neurological processes, language and acquired behavioral patterns, and that these can be changed to achieve specific goals in life.: 2 According to Bandler and Grinder, NLP can treat problems such as phobias, depression, tic disorders, psychosomatic illnesses, near-sightedness, allergy, the common cold, and learning disorders, often in a single session. They also claim that NLP can ""model"" the skills of exceptional people, allowing"
tsne,"t-distributed stochastic neighbor embedding (t-SNE) is a statistical method for visualizing high-dimensional data by giving each datapoint a location in a two or three-dimensional map. It is based on Stochastic Neighbor Embedding originally developed by Geoffrey Hinton and Sam Roweis, where Laurens van der Maaten proposed the t-distributed variant. It is a nonlinear dimensionality reduction technique for embedding high-dimensional data for visualization in a low-dimensional space of two or three dimensions. Specifically, it models each high-dimensional object by a two- or three-dimensional point in such a way that similar objects are modeled by nearby points and dissimilar objects are modeled"
language modeling,"A language model is a probabilistic model of a natural language. In 1980, the first significant statistical language model was proposed, and during the decade IBM performed ‘Shannon-style’ experiments, in which potential sources for language modeling improvement were identified by observing and analyzing the performance of human subjects in predicting or correcting text.Language models are useful for a variety of tasks, including speech recognition (helping prevent predictions of low-probability (e.g. nonsense) sequences), machine translation, natural language generation (generating more human-like text), optical character recognition, handwriting recognition, grammar induction, and information retrieval.Large language models, currently their most advanced form, are a"
text mining,"Text mining, text data mining (TDM) or text analytics is the process of deriving high-quality information from text. It involves ""the discovery by computer of new, previously unknown information, by automatically extracting information from different written resources."" Written resources may include websites, books, emails, reviews, and articles. High-quality information is typically obtained by devising patterns and trends by means such as statistical pattern learning. According to Hotho et al. (2005) we can distinguish between three different perspectives of text mining: information extraction, data mining, and a knowledge discovery in databases (KDD) process. Text mining usually involves the process of structuring"
graphical models,"A graphical model or probabilistic graphical model (PGM) or structured probabilistic model is a probabilistic model for which a graph expresses the conditional dependence structure between random variables. They are commonly used in probability theory, statistics—particularly Bayesian statistics—and machine learning. == Types of graphical models == Generally, probabilistic graphical models use a graph-based representation as the foundation for encoding a distribution over a multi-dimensional space and a graph that is a compact or factorized representation of a set of independences that hold in the specific distribution. Two branches of graphical representations of distributions are commonly used, namely, Bayesian networks and"
semantic similarity,"Semantic similarity is a metric defined over a set of documents or terms, where the idea of distance between items is based on the likeness of their meaning or semantic content as opposed to lexicographical similarity. These are mathematical tools used to estimate the strength of the semantic relationship between units of language, concepts or instances, through a numerical description obtained according to the comparison of information supporting their meaning or describing their nature. The term semantic similarity is often confused with semantic relatedness. Semantic relatedness includes any relation between two terms, while semantic similarity only includes ""is a"" relations."
noisy channel model,"The noisy channel model is a framework used in spell checkers, question answering, speech recognition, and machine translation. In this model, the goal is to find the intended word given a word where the letters have been scrambled in some manner. == In spell-checking == See Chapter B of.Given an alphabet Σ{\displaystyle \Sigma }, let Σ∗{\displaystyle \Sigma ^{*}} be the set of all finite strings over Σ{\displaystyle \Sigma }. Let the dictionary D{\displaystyle D} of valid words be some subset of Σ∗{\displaystyle \Sigma ^{*}}, i.e., D⊆Σ∗{\displaystyle D\subseteq \Sigma ^{*}}. The noisy channel is the matrix Γws=Pr(s|w){\displaystyle \Gamma _{ws}=\Pr(s|w)},where w∈D{\displaystyle w\in"
pagerank,"PageRank (PR) is an algorithm used by Google Search to rank web pages in their search engine results. It is named after both the term ""web page"" and co-founder Larry Page. PageRank is a way of measuring the importance of website pages. According to Google: PageRank works by counting the number and quality of links to a page to determine a rough estimate of how important the website is. The underlying assumption is that more important websites are likely to receive more links from other websites. Currently, PageRank is not the only algorithm used by Google to order search results,"
query expansion,"Query expansion (QE) is the process of reformulating a given query to improve retrieval performance in information retrieval operations, particularly in the context of query understanding. In the context of search engines, query expansion involves evaluating a user's input (what words were typed into the search query area, and sometimes other types of data) and expanding the search query to match additional documents. Query expansion involves techniques such as: Finding synonyms of words, and searching for the synonyms as well Finding semantically related words (e.g. antonyms, meronyms, hyponyms, hypernyms) Finding all the various morphological forms of words by stemming each"
word segmentation,"Text segmentation is the process of dividing written text into meaningful units, such as words, sentences, or topics. The term applies both to mental processes used by humans when reading text, and to artificial processes implemented in computers, which are the subject of natural language processing. The problem is non-trivial, because while some written languages have explicit word boundary markers, such as the word spaces of written English and the distinctive initial, medial and final letter shapes of Arabic, such signals are sometimes ambiguous and not present in all written languages. Compare speech segmentation, the process of dividing speech into"
text to speech generation,"Speech synthesis is the artificial production of human speech. A computer system used for this purpose is called a speech synthesizer, and can be implemented in software or hardware products. A text-to-speech (TTS) system converts normal language text into speech; other systems render symbolic linguistic representations like phonetic transcriptions into speech. The reverse process is speech recognition. Synthesized speech can be created by concatenating pieces of recorded speech that are stored in a database. Systems differ in the size of the stored speech units; a system that stores phones or diphones provides the largest output range, but may lack clarity."
dynamic programming,"Dynamic programming is both a mathematical optimization method and an algorithmic paradigm. The method was developed by Richard Bellman in the 1950s and has found applications in numerous fields, from aerospace engineering to economics. In both contexts it refers to simplifying a complicated problem by breaking it down into simpler sub-problems in a recursive manner. While some decision problems cannot be taken apart this way, decisions that span several points in time do often break apart recursively. Likewise, in computer science, if a problem can be solved optimally by breaking it into sub-problems and then recursively finding the optimal solutions"
the ibm models,"The IBM System/360 (S/360) is a family of mainframe computer systems that was announced by IBM on April 7, 1964, and delivered between 1965 and 1978. It was the first family of computers designed to cover both commercial and scientific applications and a complete range of applications from small to large. The design distinguished between architecture and implementation, allowing IBM to release a suite of compatible designs at different prices. All but the only partially compatible Model 44 and the most expensive systems use microcode to implement the instruction set, featuring 8-bit byte addressing and binary, decimal and hexadecimal floating-point"
statistical part of speech tagging,"In corpus linguistics, part-of-speech tagging (POS tagging or PoS tagging or POST), also called grammatical tagging is the process of marking up a word in a text (corpus) as corresponding to a particular part of speech, based on both its definition and its context. A simplified form of this is commonly taught to school-age children, in the identification of words as nouns, verbs, adjectives, adverbs, etc. Once performed by hand, POS tagging is now done in the context of computational linguistics, using algorithms which associate discrete terms, as well as hidden parts of speech, by a set of descriptive tags."
linear algebra,"Linear algebra is the branch of mathematics concerning linear equations such as: a1x1+⋯+anxn=b,{\displaystyle a_{1}x_{1}+\cdots +a_{n}x_{n}=b,}linear maps such as: (x1,…,xn)↦a1x1+⋯+anxn,{\displaystyle (x_{1},\ldots ,x_{n})\mapsto a_{1}x_{1}+\cdots +a_{n}x_{n},}and their representations in vector spaces and through matrices.Linear algebra is central to almost all areas of mathematics. For instance, linear algebra is fundamental in modern presentations of geometry, including for defining basic objects such as lines, planes and rotations. Also, functional analysis, a branch of mathematical analysis, may be viewed as the application of linear algebra to function spaces. Linear algebra is also used in most sciences and fields of engineering, because it allows modeling many natural"
neural parsing,"Semantic parsing is the task of converting a natural language utterance to a logical form: a machine-understandable representation of its meaning. Semantic parsing can thus be understood as extracting the precise meaning of an utterance. Applications of semantic parsing include machine translation, question answering, ontology induction, automated reasoning, and code generation. The phrase was first used in the 1970s by Yorick Wilks as the basis for machine translation programs working with only semantic representations. Semantic parsing is one of the important tasks in computational linguistics and natural language processing. Semantic parsing maps text to formal meaning representations. This contrasts with"
autonomous cars,"A self-driving car, also known as an autonomous car (AC), driverless car, robotic car or robo-car, is a car that is capable of operating with reduced or no human input. Self-driving cars are responsible for all driving activities including perceiving the environment, monitoring important systems, and controlling the vehicle, including navigating from origin to destination.ACs have the potential to impact the automotive industry, mobility costs, health, welfare, urban planning, traffic, insurance, labor market, and other domains. Appropriate regulations are necessary to integrate ACs into the existing driving environment. Multiple vendors are pursuing autonomy, although as of early 2024, no system"
nlp for databases,"Neuro-linguistic programming (NLP) is a pseudoscientific approach to communication, personal development and psychotherapy, that first appeared in Richard Bandler and John Grinder's 1975 book The Structure of Magic I. NLP asserts that there is a connection between neurological processes, language and acquired behavioral patterns, and that these can be changed to achieve specific goals in life.: 2 According to Bandler and Grinder, NLP can treat problems such as phobias, depression, tic disorders, psychosomatic illnesses, near-sightedness, allergy, the common cold, and learning disorders, often in a single session. They also claim that NLP can ""model"" the skills of exceptional people, allowing"
word sense disambiguation,"Word-sense disambiguation (WSD) is the process of identifying which sense of a word is meant in a sentence or other segment of context. In human language processing and cognition, it is usually subconscious/automatic but can often come to conscious attention when ambiguity impairs clarity of communication, given the pervasive polysemy in natural language. In computational linguistics, it is an open problem that affects other computer-related writing, such as discourse, improving relevance of search engines, anaphora resolution, coherence, and inference. Given that natural language requires reflection of neurological reality, as shaped by the abilities provided by the brain's neural networks, computer"
evaluation of text classification,"Document classification or document categorization is a problem in library science, information science and computer science. The task is to assign a document to one or more classes or categories. This may be done ""manually"" (or ""intellectually"") or algorithmically. The intellectual classification of documents has mostly been the province of library science, while the algorithmic classification of documents is mainly in information science and computer science. The problems are overlapping, however, and there is therefore interdisciplinary research on document classification. The documents to be classified may be texts, images, music, etc. Each kind of document possesses its special classification problems."
semantic role labeling,"In natural language processing, semantic role labeling (also called shallow semantic parsing or slot-filling) is the process that assigns labels to words or phrases in a sentence that indicates their semantic role in the sentence, such as that of an agent, goal, or result. It serves to find the meaning of the sentence. To do this, it detects the arguments associated with the predicate or verb of a sentence and how they are classified into their specific roles. A common example is the sentence ""Mary sold the book to John."" The agent is ""Mary,"" the predicate is ""sold"" (or rather,"
random walks and harmonic functions,"In mathematics, a random walk, sometimes known as a drunkard's walk, is a random process that describes a path that consists of a succession of random steps on some mathematical space. An elementary example of a random walk is the random walk on the integer number line Z{\displaystyle \mathbb {Z} } which starts at 0, and at each step moves +1 or −1 with equal probability. Other examples include the path traced by a molecule as it travels in a liquid or a gas (see Brownian motion), the search path of a foraging animal, or the price of a fluctuating"
cross entropy,"In information theory, the cross-entropy between two probability distributions p{\displaystyle p} and q{\displaystyle q} over the same underlying set of events measures the average number of bits needed to identify an event drawn from the set if a coding scheme used for the set is optimized for an estimated probability distribution q{\displaystyle q}, rather than the true distribution p{\displaystyle p}. == Definition == The cross-entropy of the distribution q{\displaystyle q} relative to a distribution p{\displaystyle p} over a given set is defined as follows: H(p,q)=−Ep⁡[log⁡q]{\displaystyle H(p,q)=-\operatorname {E} _{p}[\log q]},where Ep[⋅]{\displaystyle E_{p}[\cdot ]} is the expected value operator with respect to"
finite state machines,"A finite-state machine (FSM) or finite-state automaton (FSA, plural: automata), finite automaton, or simply a state machine, is a mathematical model of computation. It is an abstract machine that can be in exactly one of a finite number of states at any given time. The FSM can change from one state to another in response to some inputs; the change from one state to another is called a transition. An FSM is defined by a list of its states, its initial state, and the inputs that trigger each transition. Finite-state machines are of two types—deterministic finite-state machines and non-deterministic finite-state"
chomsky hierarchy,"The Chomsky hierarchy (infrequently referred to as the Chomsky–Schützenberger hierarchy) in the fields of formal language theory, computer science, and linguistics, is a containment hierarchy of classes of formal grammars. A formal grammar describes how to form strings from a language's vocabulary (or alphabet) that are valid according to the language's syntax. Linguist Noam Chomsky theorized that four different classes of formal grammars existed that could generate increasingly complex languages. Each class can also completely generate the language of all inferior classes (set inclusive). == History == The general idea of a hierarchy of grammars was first described by linguist"
named entity recognition,"Named-entity recognition (NER) (also known as (named) entity identification, entity chunking, and entity extraction) is a subtask of information extraction that seeks to locate and classify named entities mentioned in unstructured text into pre-defined categories such as person names, organizations, locations, medical codes, time expressions, quantities, monetary values, percentages, etc. Most research on NER/NEE systems has been structured as taking an unannotated block of text, such as this one: Jim bought 300 shares of Acme Corp. in 2006. And producing an annotated block of text that highlights the names of entities: [Jim]Person bought 300 shares of [Acme Corp.]Organization in [2006]Time."
dependency syntax,"Dependency grammar (DG) is a class of modern grammatical theories that are all based on the dependency relation (as opposed to the constituency relation of phrase structure) and that can be traced back primarily to the work of Lucien Tesnière. Dependency is the notion that linguistic units, e.g. words, are connected to each other by directed links. The (finite) verb is taken to be the structural center of clause structure. All other syntactic units (words) are either directly or indirectly connected to the verb in terms of the directed links, which are called dependencies. Dependency grammar differs from phrase structure"
speech signal analysis,"Signal processing is an electrical engineering subfield that focuses on analyzing, modifying and synthesizing signals, such as sound, images, potential fields, seismic signals, altimetry processing, and scientific measurements. Signal processing techniques are used to optimize transmissions, digital storage efficiency, correcting distorted signals, subjective video quality, and to also detect or pinpoint components of interest in a measured signal. == History == According to Alan V. Oppenheim and Ronald W. Schafer, the principles of signal processing can be found in the classical numerical analysis techniques of the 17th century. They further state that the digital refinement of these techniques can be"
training neural networks,"In machine learning, a neural network (also artificial neural network or neural net, abbreviated ANN or NN) is a model inspired by the neuronal organization found in the biological neural networks in animal brains.An ANN is made of connected units or nodes called artificial neurons, which loosely model the neurons in a brain. These are connected by edges, which model the synapses in a brain. An artificial neuron receives signals from connected neurons, then processes them and sends a signal to other connected neurons. The ""signal"" is a real number, and the output of each neuron is computed by some"
grammar checker,"A grammar checker, in computing terms, is a program, or part of a program, that attempts to verify written text for grammatical correctness. Grammar checkers are most often implemented as a feature of a larger program, such as a word processor, but are also available as a stand-alone application that can be activated from within programs that work with editable text. The implementation of a grammar checker makes use of natural language processing. == History == The earliest ""grammar checkers"" were programs that checked for punctuation and style inconsistencies, rather than a complete range of possible grammatical errors. The first"
information extraction,"Information extraction (IE) is the task of automatically extracting structured information from unstructured and/or semi-structured machine-readable documents and other electronically represented sources. Typically, this involves processing human language texts by means of natural language processing (NLP). Recent activities in multimedia document processing like automatic annotation and content extraction out of images/audio/video/documents could be seen as information extraction. Recent advances in NLP techniques have allowed for significantly improved performance compared to previous years. An example is the extraction from newswire reports of corporate mergers, such as denoted by the formal relation: MergerBetween(company1,company2,date){\displaystyle \mathrm {MergerBetween} (company_{1},company_{2},date)},from an online news sentence such as:"
linear discriminant analysis,"Linear discriminant analysis (LDA), normal discriminant analysis (NDA), or discriminant function analysis is a generalization of Fisher's linear discriminant, a method used in statistics and other fields, to find a linear combination of features that characterizes or separates two or more classes of objects or events. The resulting combination may be used as a linear classifier, or, more commonly, for dimensionality reduction before later classification. LDA is closely related to analysis of variance (ANOVA) and regression analysis, which also attempt to express one dependent variable as a linear combination of other features or measurements. However, ANOVA uses categorical independent variables"
adversarial search,"In computer science, a search algorithm is an algorithm designed to solve a search problem. Search algorithms work to retrieve information stored within particular data structure, or calculated in the search space of a problem domain, with either discrete or continuous values. Although search engines use search algorithms, they belong to the study of information retrieval, not algorithmics. The appropriate search algorithm to use often depends on the data structure being searched, and may also include prior knowledge about the data. Search algorithms can be made faster or more efficient by specially constructed database structures, such as search trees, hash"
propositional logic,"The propositional calculus is a branch of logic. It is also called propositional logic, statement logic, sentential calculus, sentential logic, or sometimes zeroth-order logic. It deals with propositions (which can be true or false) and relations between propositions, including the construction of arguments based on them. Compound propositions are formed by connecting propositions by logical connectives representing the truth functions of conjunction, disjunction, implication, equivalence, and negation. Some sources include other connectives, as in the table below. Unlike first-order logic, propositional logic does not deal with non-logical objects, predicates about them, or quantifiers. However, all the machinery of propositional logic"
natural language processing intro,"Natural language processing (NLP) is an interdisciplinary subfield of computer science and information retrieval. It is primarily concerned with giving computers the ability to support and manipulate human language. It involves processing natural language datasets, such as text corpora or speech corpora, using either rule-based or probabilistic (i.e. statistical and, most recently, neural network-based) machine learning approaches. The goal is a computer capable of ""understanding"" the contents of documents, including the contextual nuances of the language within them. To this end, natural language processing often borrows ideas from theoretical linguistics. The technology can then accurately extract information and insights contained"
