spelling correction,"Dogpile is a metasearch engine for information on the World Wide Web that fetches results from Google, Yahoo!, Yandex, Bing, and other popular search engines, including those from audio and video content providers such as Yahoo!. == History == Dogpile began operation in November 1996. The site was created and developed by Aaron Flin, who was frustrated with the varying results of existing indexes and intending on making Dogpile query multiple indexes for the best search results. It originally provided web searches from Yahoo! (directory), Lycos (inc. A2Z directory), Excite (inc. Excite Guide directory), WebCrawler, Infoseek, AltaVista, HotBot, WhatUseek (directory),"
structured prediction,"Structured prediction or structured (output) learning is an umbrella term for supervised machine learning techniques that involves predicting structured objects, rather than scalar discrete or real values.Similar to commonly used supervised learning techniques, structured prediction models are typically trained by means of observed data in which the true prediction value is used to adjust model parameters. Due to the complexity of the model and the interrelations of predicted variables the process of prediction using a trained model and of training itself is often computationally infeasible and approximate inference and learning methods are used. == Applications == For example, the problem"
pointer networks,"There are many types of artificial neural networks (ANN). Artificial neural networks are computational models inspired by biological neural networks, and are used to approximate functions that are generally unknown. Particularly, they are inspired by the behaviour of neurons and the electrical signals they convey between input (such as from the eyes or nerve endings in the hand), processing, and output from the brain (such as reacting to light, touch, or heat). The way neurons semantically communicate is an area of ongoing research. Most artificial neural networks bear only some resemblance to their more complex biological counterparts, but are very"
spectral methods,"Spectral methods are a class of techniques used in applied mathematics and scientific computing to numerically solve certain differential equations. The idea is to write the solution of the differential equation as a sum of certain ""basis functions"" (for example, as a Fourier series which is a sum of sinusoids) and then to choose the coefficients in the sum in order to satisfy the differential equation as well as possible. Spectral methods and finite-element methods are closely related and built on the same ideas; the main difference between them is that spectral methods use basis functions that are generally nonzero"
graph convolutional networks,"A graph neural network (GNN) belongs to a class of artificial neural networks for processing data that can be represented as graphs. In the more general subject of ""geometric deep learning"", certain existing neural network architectures can be interpreted as GNNs operating on suitably defined graphs. A convolutional neural network layer, in the context of computer vision, can be seen as a GNN applied to graphs whose nodes are pixels and only adjacent pixels are connected by edges in the graph. A transformer layer, in natural language processing, can be seen as a GNN applied to complete graphs whose nodes"
syntax,"In linguistics, syntax ( SIN-taks) is the study of how words and morphemes combine to form larger units such as phrases and sentences. Central concerns of syntax include word order, grammatical relations, hierarchical sentence structure (constituency), agreement, the nature of crosslinguistic variation, and the relationship between form and meaning (semantics). There are numerous approaches to syntax that differ in their central assumptions and goals. == Etymology == The word syntax comes from Ancient Greek roots: σύνταξις ""coordination"", which consists of σύν syn, ""together"", and τάξις táxis, ""ordering"". == Topics == The field of syntax contains a number of various topics"
markov decision processes,"In mathematics, a Markov decision process (MDP) is a discrete-time stochastic control process. It provides a mathematical framework for modeling decision making in situations where outcomes are partly random and partly under the control of a decision maker. MDPs are useful for studying optimization problems solved via dynamic programming. MDPs were known at least as early as the 1950s; a core body of research on Markov decision processes resulted from Ronald Howard's 1960 book, Dynamic Programming and Markov Processes. They are used in many disciplines, including robotics, automatic control, economics and manufacturing. The name of MDPs comes from the Russian"
sentiment analysis,"Sentiment analysis (also known as opinion mining or emotion AI) is the use of natural language processing, text analysis, computational linguistics, and biometrics to systematically identify, extract, quantify, and study affective states and subjective information. Sentiment analysis is widely applied to voice of the customer materials such as reviews and survey responses, online and social media, and healthcare materials for applications that range from marketing to customer service to clinical medicine. With the rise of deep language models, such as RoBERTa, also more difficult data domains can be analyzed, e.g., news texts where authors typically express their opinion/sentiment less explicitly."
planning,"Planning is the process of thinking regarding the activities required to achieve a desired goal. Planning is based on foresight, the fundamental capacity for mental time travel. Some researchers regard the evolution of forethought - the capacity to think ahead - as a prime mover in human evolution. Planning is a fundamental property of intelligent behavior. It involves the use of logic and imagination to visualize not only a desired result, but the steps necessary to achieve that result. An important aspect of planning is its relationship to forecasting. Forecasting aims to predict what the future will look like, while"
calculus,"Calculus is the mathematical study of continuous change, in the same way that geometry is the study of shape, and algebra is the study of generalizations of arithmetic operations. Originally called infinitesimal calculus or ""the calculus of infinitesimals"", it has two major branches, differential calculus and integral calculus. The former concerns instantaneous rates of change, and the slopes of curves, while the latter concerns accumulation of quantities, and areas under or between curves. These two branches are related to each other by the fundamental theorem of calculus, and they make use of the fundamental notions of convergence of infinite sequences"
shallow parsing,"Shallow parsing (also chunking or light parsing) is an analysis of a sentence which first identifies constituent parts of sentences (nouns, verbs, adjectives, etc.) and then links them to higher order units that have discrete grammatical meanings (noun groups or phrases, verb groups, etc.). While the most elementary chunking algorithms simply link constituent parts on the basis of elementary search patterns (e.g., as specified by regular expressions), approaches that use machine learning techniques (classifiers, topic modeling, etc.) can take contextual information into account and thus compose chunks in such a way that they better reflect the semantic relations between the"
harmonic functions,"In mathematics, mathematical physics and the theory of stochastic processes, a harmonic function is a twice continuously differentiable function f:U→R,{\displaystyle f\colon U\to \mathbb {R} ,} where U is an open subset of Rn,{\displaystyle \mathbb {R} ^{n},} that satisfies Laplace's equation, that is, ∂2f∂x12+∂2f∂x22+⋯+∂2f∂xn2=0{\displaystyle {\frac {\partial ^{2}f}{\partial x_{1}^{2}}}+{\frac {\partial ^{2}f}{\partial x_{2}^{2}}}+\cdots +{\frac {\partial ^{2}f}{\partial x_{n}^{2}}}=0}everywhere on U. This is usually written as ∇2f=0{\displaystyle \nabla ^{2}f=0}or Δf=0{\displaystyle \Delta f=0} == Etymology of the term ""harmonic"" == The descriptor ""harmonic"" in the name harmonic function originates from a point on a taut string which is undergoing harmonic motion. The solution to the differential"
language identification,"In natural language processing, language identification or language guessing is the problem of determining which natural language given content is in. Computational approaches to this problem view it as a special case of text categorization, solved with various statistical methods. == Overview == There are several statistical approaches to language identification using different techniques to classify the data. One technique is to compare the compressibility of the text to the compressibility of texts in a set of known languages. This approach is known as mutual information based distance measure. The same technique can also be used to empirically construct family"
semi-supervised learning,"Weak supervision is a paradigm in machine learning, the relevance and notability of which increased with the advent of large language models due to large amount of data required to train them. It is characterized by using a combination of a small amount of human-labeled data (exclusively used in more expensive and time-consuming supervised learning paradigm), followed by a large amount of unlabeled data (used exclusively in unsupervised learning paradigm). In other words, the desired output values are provided only for a subset of the training data. The remaining data is unlabeled or imprecisely labeled. Intuitively, it can be seen"
dialog systems,"A dialogue system, or conversational agent (CA), is a computer system intended to converse with a human. Dialogue systems employed one or more of text, speech, graphics, haptics, gestures, and other modes for communication on both the input and output channel. The elements of a dialogue system are not defined because this idea is under research, however, they are different from chatbot. The typical GUI wizard engages in a sort of dialogue, but it includes very few of the common dialogue system components, and the dialogue state is trivial. == Background == After dialogue systems based only on written text"
event detection,"Activity recognition aims to recognize the actions and goals of one or more agents from a series of observations on the agents' actions and the environmental conditions. Since the 1980s, this research field has captured the attention of several computer science communities due to its strength in providing personalized support for many different applications and its connection to many different fields of study such as medicine, human-computer interaction, or sociology. Due to its multifaceted nature, different fields may refer to activity recognition as plan recognition, goal recognition, intent recognition, behavior recognition, location estimation and location-based services. == Types == ==="
cky parsing,"Syntactic parsing is the automatic analysis of syntactic structure of natural language, especially syntactic relations (in dependency grammar) and labelling spans of constituents (in constituency grammar). It is motivated by the problem of structural ambiguity in natural language: a sentence can be assigned multiple grammatical parses, so some kind of knowledge beyond computational grammar rules is needed to tell which parse is intended. Syntactic parsing is one of the important tasks in computational linguistics and natural language processing, and has been a subject of research since the mid-20th century with the advent of computers. Different theories of grammar propose different"
a* search,"Abbas Abad (Persian: عباس آبا, also Romanized as ‘Abbās Ābā; also known as ‘Abbāsābād) is a village in Meyami Rural District, in the Central District of Meyami County, Semnan Province, Iran. At the 2006 census, its population was 458, in 132 families. == References =="
automated essay scoring,"Automated essay scoring (AES) is the use of specialized computer programs to assign grades to essays written in an educational setting. It is a form of educational assessment and an application of natural language processing. Its objective is to classify a large set of textual entities into a small number of discrete categories, corresponding to the possible grades, for example, the numbers 1 to 6. Therefore, it can be considered a problem of statistical classification. Several factors have contributed to a growing interest in AES. Among them are cost, accountability, standards, and technology. Rising education costs have led to pressure"
matrix multiplication,"In mathematics, particularly in linear algebra, matrix multiplication is a binary operation that produces a matrix from two matrices. For matrix multiplication, the number of columns in the first matrix must be equal to the number of rows in the second matrix. The resulting matrix, known as the matrix product, has the number of rows of the first and the number of columns of the second matrix. The product of matrices A and B is denoted as AB.Matrix multiplication was first described by the French mathematician Jacques Philippe Marie Binet in 1812, to represent the composition of linear maps that"
phrase based machine translation,"Google Neural Machine Translation (GNMT) is a neural machine translation (NMT) system developed by Google and introduced in November 2016 that uses an artificial neural network to increase fluency and accuracy in Google Translate. The neural network consists of two main blocks, an encoder and a decoder, both of LSTM architecture with 8 1024-wide layers each and a simple 1-layer 1024-wide feedforward attention mechanism connecting them. The total number of parameters has been variously described as over 160 million, approximately 210 million, 278 million or 380 million.GNMT improves on the quality of translation by applying an example-based (EBMT) machine translation"
neural turing machine,"A neural Turing machine (NTM) is a recurrent neural network model of a Turing machine. The approach was published by Alex Graves et al. in 2014. NTMs combine the fuzzy pattern matching capabilities of neural networks with the algorithmic power of programmable computers. An NTM has a neural network controller coupled to external memory resources, which it interacts with through attentional mechanisms. The memory interactions are differentiable end-to-end, making it possible to optimize them using gradient descent. An NTM with a long short-term memory (LSTM) network controller can infer simple algorithms such as copying, sorting, and associative recall from examples"
graph theory,"In mathematics, graph theory is the study of graphs, which are mathematical structures used to model pairwise relations between objects. A graph in this context is made up of vertices (also called nodes or points) which are connected by edges (also called arcs, links or lines). A distinction is made between undirected graphs, where edges link two vertices symmetrically, and directed graphs, where edges link two vertices asymmetrically. Graphs are one of the principal objects of study in discrete mathematics. == Definitions == Definitions in graph theory vary. The following are some of the more basic ways of defining graphs"
semantic parsing,"Semantic parsing is the task of converting a natural language utterance to a logical form: a machine-understandable representation of its meaning. Semantic parsing can thus be understood as extracting the precise meaning of an utterance. Applications of semantic parsing include machine translation, question answering, ontology induction, automated reasoning, and code generation. The phrase was first used in the 1970s by Yorick Wilks as the basis for machine translation programs working with only semantic representations. Semantic parsing is one of the important tasks in computational linguistics and natural language processing. Semantic parsing maps text to formal meaning representations. This contrasts with"
thesaurus-based similarity,"The Topic-based Vector Space Model (TVSM) (literature: [1]) extends the vector space model of information retrieval by removing the constraint that the term-vectors be orthogonal. The assumption of orthogonal terms is incorrect regarding natural languages which causes problems with synonyms and strong related terms. This facilitates the use of stopword lists, stemming and thesaurus in TVSM. In contrast to the generalized vector space model the TVSM does not depend on concurrence-based similarities between terms. == Definitions == The basic premise of TVSM is the existence of a d dimensional space R with only positive axis intercepts, i.e. R in R+"
statistical machine translation,"Statistical machine translation (SMT) was a machine translation approach, that superseded the previous, rule-based approach because it required explicit description of each and every linguistic rule, which was costly, and which often did not generalize to other languages. Since 2003, the statistical approach itself has been gradually superseded by the deep learning-based neural network approach. The first ideas of statistical machine translation were introduced by Warren Weaver in 1949, including the ideas of applying Claude Shannon's information theory. Statistical machine translation was re-introduced in the late 1980s and early 1990s by researchers at IBM's Thomas J. Watson Research Center =="
greedy algorithms,"A greedy algorithm is any algorithm that follows the problem-solving heuristic of making the locally optimal choice at each stage. In many problems, a greedy strategy does not produce an optimal solution, but a greedy heuristic can yield locally optimal solutions that approximate a globally optimal solution in a reasonable amount of time. For example, a greedy strategy for the travelling salesman problem (which is of high computational complexity) is the following heuristic: ""At each step of the journey, visit the nearest unvisited city."" This heuristic does not intend to find the best solution, but it terminates in a reasonable"
parts of speech,"In grammar, a part of speech or part-of-speech (abbreviated as POS or PoS, also known as word class or grammatical category) is a category of words (or, more generally, of lexical items) that have similar grammatical properties. Words that are assigned to the same part of speech generally display similar syntactic behavior (they play similar roles within the grammatical structure of sentences), sometimes similar morphological behavior in that they undergo inflection for similar properties and even similar semantic behavior. Commonly listed English parts of speech are noun, verb, adjective, adverb, pronoun, preposition, conjunction, interjection, numeral, article, and determiner. Other terms"
context sensitive grammar,"A context-sensitive grammar (CSG) is a formal grammar in which the left-hand sides and right-hand sides of any production rules may be surrounded by a context of terminal and nonterminal symbols. Context-sensitive grammars are more general than context-free grammars, in the sense that there are languages that can be described by a CSG but not by a context-free grammar. Context-sensitive grammars are less general (in the same sense) than unrestricted grammars. Thus, CSGs are positioned between context-free and unrestricted grammars in the Chomsky hierarchy.A formal language that can be described by a context-sensitive grammar, or, equivalently, by a noncontracting grammar"
memory networks,"A recurrent neural network (RNN) is one of the two broad types of artificial neural network, characterized by direction of the flow of information between its layers. In contrast to the uni-directional feedforward neural network, it is a bi-directional artificial neural network, meaning that it allows the output from some nodes to affect subsequent input to the same nodes. Their ability to use internal state (memory) to process arbitrary sequences of inputs makes them applicable to tasks such as unsegmented, connected handwriting recognition or speech recognition. The term ""recurrent neural network"" is used to refer to the class of networks"
genetic algorithms,"In computer science and operations research, a genetic algorithm (GA) is a metaheuristic inspired by the process of natural selection that belongs to the larger class of evolutionary algorithms (EA). Genetic algorithms are commonly used to generate high-quality solutions to optimization and search problems by relying on biologically inspired operators such as mutation, crossover and selection. Some examples of GA applications include optimizing decision trees for better performance, solving sudoku puzzles, hyperparameter optimization, causal inference, etc. == Methodology == === Optimization problems === In a genetic algorithm, a population of candidate solutions (called individuals, creatures, organisms, or phenotypes) to an"
transfer learning,"Transfer learning (TL) is a technique in machine learning (ML) in which knowledge learned from a task is re-used in order to boost performance on a related task. For example, for image classification, knowledge gained while learning to recognize cars could be applied when trying to recognize trucks. This topic is related to the psychological literature on transfer of learning, although practical ties between the two fields are limited. Reusing/transferring information from previously learned tasks to new tasks has the potential to significantly improve learning efficiency.Since transfer learning makes use of training with multiple objective functions it is related to"
structured learning,"Structured prediction or structured (output) learning is an umbrella term for supervised machine learning techniques that involves predicting structured objects, rather than scalar discrete or real values.Similar to commonly used supervised learning techniques, structured prediction models are typically trained by means of observed data in which the true prediction value is used to adjust model parameters. Due to the complexity of the model and the interrelations of predicted variables the process of prediction using a trained model and of training itself is often computationally infeasible and approximate inference and learning methods are used. == Applications == For example, the problem"
named entity recognition,"Named-entity recognition (NER) (also known as (named) entity identification, entity chunking, and entity extraction) is a subtask of information extraction that seeks to locate and classify named entities mentioned in unstructured text into pre-defined categories such as person names, organizations, locations, medical codes, time expressions, quantities, monetary values, percentages, etc. Most research on NER/NEE systems has been structured as taking an unannotated block of text, such as this one: Jim bought 300 shares of Acme Corp. in 2006. And producing an annotated block of text that highlights the names of entities: [Jim]Person bought 300 shares of [Acme Corp.]Organization in [2006]Time."
lexical semantics,"Lexical semantics (also known as lexicosemantics), as a subfield of linguistic semantics, is the study of word meanings. It includes the study of how words structure their meaning, how they act in grammar and compositionality, and the relationships between the distinct senses and uses of a word.The units of analysis in lexical semantics are lexical units which include not only words but also sub-words or sub-units such as affixes and even compound words and phrases. Lexical units include the catalogue of words in a language, the lexicon. Lexical semantics looks at how the meaning of the lexical units correlates with"
collaborative filtering,"Collaborative filtering (CF) is a technique used by recommender systems. Collaborative filtering has two senses, a narrow one and a more general one.In the newer, narrower sense, collaborative filtering is a method of making automatic predictions (filtering) about the interests of a user by collecting preferences or taste information from many users (collaborating). The underlying assumption of the collaborative filtering approach is that if a person A has the same opinion as a person B on an issue, A is more likely to have B's opinion on a different issue than that of a randomly chosen person. For example, a"
evaluation of language modeling,"A language model is a probabilistic model of a natural language. In 1980, the first significant statistical language model was proposed, and during the decade IBM performed ‘Shannon-style’ experiments, in which potential sources for language modeling improvement were identified by observing and analyzing the performance of human subjects in predicting or correcting text.Language models are useful for a variety of tasks, including speech recognition (helping prevent predictions of low-probability (e.g. nonsense) sequences), machine translation, natural language generation (generating more human-like text), optical character recognition, handwriting recognition, grammar induction, and information retrieval.Large language models, currently their most advanced form, are a"
bias-variance,"In statistics and machine learning, the bias–variance tradeoff describes the relationship between a model's complexity, the accuracy of its predictions, and how well it can make predictions on previously unseen data that were not used to train the model. In general, as we increase the number of tunable parameters in a model, it becomes more flexible, and can better fit a training data set. It is said to have lower error, or bias. However, for more flexible models, there will tend to be greater variance to the model fit each time we take a set of samples to create a"
